{"algorithm":"owntracks-normalizer-v1","algorithm_config_version":"0000000000000000","captured_at":"2026-01-01T00:00:00Z","device_id":"dev_00000000","horizontal_accuracy_m":1.0,"ingest_id":"ing_00000000000000000000","latitude":0.0,"longitude":0.0,"observation_id":"obs_00000000000000000000000000000000","privacy_class":"restricted","processed_at":"2026-01-01T00:00:02Z","quality_flags":[],"received_at":"2026-01-01T00:00:01Z","schema_version":"1","source":"owntracks","source_digest":"0000000000000000000000000000000000000000000000000000000000000000","source_type":"location","subject_id":"sub_00000000"}
